{
  "version": "0.7.0",
  "request": {
    "url": "alpine:latest",
    "registry": "registry-1.docker.io",
    "repository": "library/alpine",
    "tag": "latest",
    "analyzers": [
      "dockle",
      "endoflife",
      "freshness",
      "hadolint",
      "popularity",
      "provenance",
      "sbom",
      "scorecarddev",
      "size",
      "skopeo",
      "trivy",
      "versioning"
    ],
    "timestamp": "2026-03-04T19:07:58.573003+00:00"
  },
  "results": {
    "dockle": {
      "analyzer": "dockle",
      "error": {
        "type": "validation",
        "message": "Dockle execution failed. Ensure dockle is installed and in PATH."
      }
    },
    "endoflife": {
      "analyzer": "endoflife",
      "repository": "library/alpine",
      "product": "alpine",
      "product_found": true,
      "tag": "latest",
      "matched_cycle": null,
      "is_eol": null,
      "active_cycles_count": 0,
      "eol_cycles_count": 31
    },
    "freshness": {
      "analyzer": "freshness",
      "repository": "library/alpine",
      "tag": "latest",
      "tag_created": "2026-01-28T01:18:04.977843834Z",
      "latest_created": null,
      "age_days": 35,
      "behind_latest_days": null,
      "is_latest": true
    },
    "hadolint": {
      "analyzer": "hadolint",
      "repository": "library/alpine",
      "tag": "latest",
      "passed": false,
      "issues_count": 1,
      "issues_by_level": {
        "error": 0,
        "warning": 0,
        "info": 1,
        "style": 0
      },
      "issues": [
        {
          "code": "DL3059",
          "level": "info",
          "message": "Multiple consecutive `RUN` instructions. Consider consolidation.",
          "line": 3
        }
      ],
      "dockerfile": "FROM scratch\nRUN ADD alpine-minirootfs-3.23.3-x86_64.tar.gz / # buildkit\nRUN CMD [\"/bin/sh\"]"
    },
    "popularity": {
      "analyzer": "popularity",
      "repository": "library/alpine",
      "available": true,
      "pull_count": 11696404986,
      "star_count": 11471,
      "description": "A minimal Docker image based on Alpine Linux with a complete package index and only 5 MB in size!",
      "last_updated": "2026-01-28T04:26:42.651499Z",
      "date_registered": "2015-03-17T23:16:05.407728Z",
      "is_official": true
    },
    "provenance": {
      "analyzer": "provenance",
      "repository": "library/alpine",
      "tag": "latest",
      "has_provenance": false,
      "has_cosign_signature": false,
      "source_tracked": false,
      "indicators_count": 0,
      "indicators": []
    },
    "sbom": {
      "analyzer": "sbom",
      "repository": "library/alpine",
      "tag": "latest",
      "has_sbom": true,
      "sbom_format": "CycloneDX",
      "sbom_version": "1.6",
      "total_components": 17,
      "component_types": {
        "operating-system": 1,
        "library": 16
      },
      "total_dependencies": 18,
      "licenses": [
        "Apache-2.0",
        "BSD-2-Clause",
        "GPL-2.0-only",
        "GPL-2.0-or-later",
        "MIT",
        "MPL-2.0",
        "Zlib"
      ],
      "components": [
        {
          "name": "alpine",
          "version": "3.23.3",
          "type": "operating-system",
          "purl": null,
          "licenses": []
        },
        {
          "name": "alpine-baselayout-data",
          "version": "3.7.1-r8",
          "type": "library",
          "purl": "pkg:apk/alpine/alpine-baselayout-data@3.7.1-r8?arch=x86_64&distro=3.23.3",
          "licenses": [
            "GPL-2.0-only"
          ]
        },
        {
          "name": "alpine-baselayout",
          "version": "3.7.1-r8",
          "type": "library",
          "purl": "pkg:apk/alpine/alpine-baselayout@3.7.1-r8?arch=x86_64&distro=3.23.3",
          "licenses": [
            "GPL-2.0-only"
          ]
        },
        {
          "name": "alpine-keys",
          "version": "2.6-r0",
          "type": "library",
          "purl": "pkg:apk/alpine/alpine-keys@2.6-r0?arch=x86_64&distro=3.23.3",
          "licenses": [
            "MIT"
          ]
        },
        {
          "name": "alpine-release",
          "version": "3.23.3-r0",
          "type": "library",
          "purl": "pkg:apk/alpine/alpine-release@3.23.3-r0?arch=x86_64&distro=3.23.3",
          "licenses": [
            "MIT"
          ]
        },
        {
          "name": "apk-tools",
          "version": "3.0.3-r1",
          "type": "library",
          "purl": "pkg:apk/alpine/apk-tools@3.0.3-r1?arch=x86_64&distro=3.23.3",
          "licenses": [
            "GPL-2.0-only"
          ]
        },
        {
          "name": "busybox-binsh",
          "version": "1.37.0-r30",
          "type": "library",
          "purl": "pkg:apk/alpine/busybox-binsh@1.37.0-r30?arch=x86_64&distro=3.23.3",
          "licenses": [
            "GPL-2.0-only"
          ]
        },
        {
          "name": "busybox",
          "version": "1.37.0-r30",
          "type": "library",
          "purl": "pkg:apk/alpine/busybox@1.37.0-r30?arch=x86_64&distro=3.23.3",
          "licenses": [
            "GPL-2.0-only"
          ]
        },
        {
          "name": "ca-certificates-bundle",
          "version": "20251003-r0",
          "type": "library",
          "purl": "pkg:apk/alpine/ca-certificates-bundle@20251003-r0?arch=x86_64&distro=3.23.3",
          "licenses": [
            "MPL-2.0",
            "MIT"
          ]
        },
        {
          "name": "libapk",
          "version": "3.0.3-r1",
          "type": "library",
          "purl": "pkg:apk/alpine/libapk@3.0.3-r1?arch=x86_64&distro=3.23.3",
          "licenses": [
            "GPL-2.0-only"
          ]
        },
        {
          "name": "libcrypto3",
          "version": "3.5.5-r0",
          "type": "library",
          "purl": "pkg:apk/alpine/libcrypto3@3.5.5-r0?arch=x86_64&distro=3.23.3",
          "licenses": [
            "Apache-2.0"
          ]
        },
        {
          "name": "libssl3",
          "version": "3.5.5-r0",
          "type": "library",
          "purl": "pkg:apk/alpine/libssl3@3.5.5-r0?arch=x86_64&distro=3.23.3",
          "licenses": [
            "Apache-2.0"
          ]
        },
        {
          "name": "musl-utils",
          "version": "1.2.5-r21",
          "type": "library",
          "purl": "pkg:apk/alpine/musl-utils@1.2.5-r21?arch=x86_64&distro=3.23.3",
          "licenses": [
            "MIT",
            "BSD-2-Clause",
            "GPL-2.0-or-later"
          ]
        },
        {
          "name": "musl",
          "version": "1.2.5-r21",
          "type": "library",
          "purl": "pkg:apk/alpine/musl@1.2.5-r21?arch=x86_64&distro=3.23.3",
          "licenses": [
            "MIT"
          ]
        },
        {
          "name": "scanelf",
          "version": "1.3.8-r2",
          "type": "library",
          "purl": "pkg:apk/alpine/scanelf@1.3.8-r2?arch=x86_64&distro=3.23.3",
          "licenses": [
            "GPL-2.0-only"
          ]
        },
        {
          "name": "ssl_client",
          "version": "1.37.0-r30",
          "type": "library",
          "purl": "pkg:apk/alpine/ssl_client@1.37.0-r30?arch=x86_64&distro=3.23.3",
          "licenses": [
            "GPL-2.0-only"
          ]
        },
        {
          "name": "zlib",
          "version": "1.3.1-r2",
          "type": "library",
          "purl": "pkg:apk/alpine/zlib@1.3.1-r2?arch=x86_64&distro=3.23.3",
          "licenses": [
            "Zlib"
          ]
        }
      ]
    },
    "scorecarddev": {
      "analyzer": "scorecarddev",
      "repository": "library/alpine",
      "source_repo": "https://github.com/alpinelinux/docker-alpine",
      "scorecard_available": false,
      "score": null,
      "checks": []
    },
    "size": {
      "analyzer": "size",
      "repository": "library/alpine",
      "tag": "latest",
      "multi_arch": true,
      "total_compressed_bytes": 3862432,
      "total_compressed_human": "3.7 MB",
      "layer_count": 1,
      "config_size_bytes": 0,
      "layers": [],
      "platforms": [
        {
          "platform": "linux/amd64",
          "compressed_bytes": 3862432,
          "compressed_human": "3.7 MB",
          "layer_count": 1
        },
        {
          "platform": "unknown/unknown",
          "compressed_bytes": 85529,
          "compressed_human": "83.5 KB",
          "layer_count": 2
        },
        {
          "platform": "linux/arm/v6",
          "compressed_bytes": 3570444,
          "compressed_human": "3.4 MB",
          "layer_count": 1
        },
        {
          "platform": "unknown/unknown",
          "compressed_bytes": 5632,
          "compressed_human": "5.5 KB",
          "layer_count": 1
        },
        {
          "platform": "linux/arm/v7",
          "compressed_bytes": 3282347,
          "compressed_human": "3.1 MB",
          "layer_count": 1
        },
        {
          "platform": "unknown/unknown",
          "compressed_bytes": 84956,
          "compressed_human": "83.0 KB",
          "layer_count": 2
        },
        {
          "platform": "linux/arm64/v8",
          "compressed_bytes": 4197718,
          "compressed_human": "4.0 MB",
          "layer_count": 1
        },
        {
          "platform": "unknown/unknown",
          "compressed_bytes": 85001,
          "compressed_human": "83.0 KB",
          "layer_count": 2
        },
        {
          "platform": "linux/386",
          "compressed_bytes": 3687601,
          "compressed_human": "3.5 MB",
          "layer_count": 1
        },
        {
          "platform": "unknown/unknown",
          "compressed_bytes": 85465,
          "compressed_human": "83.5 KB",
          "layer_count": 2
        },
        {
          "platform": "linux/ppc64le",
          "compressed_bytes": 3830257,
          "compressed_human": "3.7 MB",
          "layer_count": 1
        },
        {
          "platform": "unknown/unknown",
          "compressed_bytes": 84948,